Dowiedz się więcej;Find out more
Więcej na temat tego czym jest <strong>Trendmed</strong> możesz dowiedzieć się z naszej prezentacji.;More about what Trendmed.eu is you will find out from our PDF presentation.
Z chęcią wysłuchamy jakichkolwiek uwag odnośnie funkcjonowania naszego portalu.;We will gladly listen to your feedback
Uwagi;Comments
Wyślij;Send
Wszelkie uwagi i sugestie odnośnie funkcjonalnowania naszego portalu;Any suggestion about our service
Regulamin dla placówek;Clinics terms of use
Regulamin dla pacjentów;Patients terms of use
Wszystkie placówki;All types
Tylko szpitale, kliniki i sanatoria;Only hospitals, clinics and resorts
Tylko gabinety, salony i spa;Only offices, saloons and spa